{
  "specificationVersion": "TRADING_ANALYTICS_RESULT_HASH_V1",
  "resultSchemaVersion": "TRADING_ANALYTICS_RESULT_SCHEMA_V1",
  "referenceCatalog": {
    "reviewUnitIds": [
      "baseline-1",
      "baseline-2",
      "baseline-3",
      "censored-1",
      "entry-1",
      "loss-1",
      "loss-2",
      "win-1",
      "win-2"
    ],
    "allocations": [
      {
        "allocationId": "allocation-baseline-1",
        "reviewUnitId": "baseline-1",
        "recordId": "record-baseline-1"
      },
      {
        "allocationId": "allocation-baseline-2",
        "reviewUnitId": "baseline-2",
        "recordId": "record-baseline-2"
      },
      {
        "allocationId": "allocation-baseline-3",
        "reviewUnitId": "baseline-3",
        "recordId": "record-baseline-3"
      },
      {
        "allocationId": "allocation-censored-1",
        "reviewUnitId": "censored-1",
        "recordId": "record-censored-1"
      },
      {
        "allocationId": "allocation-entry-1",
        "reviewUnitId": "entry-1",
        "recordId": "record-entry-1"
      },
      {
        "allocationId": "allocation-loss-1",
        "reviewUnitId": "loss-1",
        "recordId": "record-loss-1"
      },
      {
        "allocationId": "allocation-loss-2",
        "reviewUnitId": "loss-2",
        "recordId": "record-loss-2"
      },
      {
        "allocationId": "allocation-win-1",
        "reviewUnitId": "win-1",
        "recordId": "record-win-1"
      },
      {
        "allocationId": "allocation-win-2",
        "reviewUnitId": "win-2",
        "recordId": "record-win-2"
      }
    ],
    "recordIds": [
      "record-baseline-1",
      "record-baseline-2",
      "record-baseline-3",
      "record-censored-1",
      "record-entry-1",
      "record-loss-1",
      "record-loss-2",
      "record-win-1",
      "record-win-2"
    ],
    "sourceEvidenceSnapshotIds": [
      "snapshot-baseline-1",
      "snapshot-baseline-2",
      "snapshot-baseline-3",
      "snapshot-censored-1",
      "snapshot-entry-1",
      "snapshot-loss-1",
      "snapshot-loss-2",
      "snapshot-win-1",
      "snapshot-win-2"
    ]
  },
  "sections": {
    "OUTCOME_CLASSIFICATIONS": [
      {
        "reviewUnitId": "censored-1",
        "outcome": "UNAVAILABLE",
        "netTradingPnl": null,
        "settlementCurrency": null,
        "allocatedReportedPnl": [],
        "allocatedFees": [],
        "membershipId": "WIN_LOSS_HOLDING_DURATION_DIFFERENCE:censored-1:EXCLUDED:RECONSTRUCTION_NOT_COMPLETE"
      },
      {
        "reviewUnitId": "loss-1",
        "outcome": "LOSS",
        "netTradingPnl": "-10",
        "settlementCurrency": "USDT",
        "allocatedReportedPnl": [
          {
            "recordId": "record-loss-1",
            "amount": "-9",
            "currency": "USDT"
          }
        ],
        "allocatedFees": [
          {
            "recordId": "record-loss-1",
            "amount": "1",
            "currency": "USDT"
          }
        ],
        "membershipId": "ENTRY_WITHIN_WINDOW_AFTER_LOSS:loss-1:SUBJECT:"
      },
      {
        "reviewUnitId": "loss-2",
        "outcome": "LOSS",
        "netTradingPnl": "-5",
        "settlementCurrency": "USDT",
        "allocatedReportedPnl": [],
        "allocatedFees": [],
        "membershipId": "WIN_LOSS_HOLDING_DURATION_DIFFERENCE:loss-2:COMPARISON:"
      },
      {
        "reviewUnitId": "win-1",
        "outcome": "WIN",
        "netTradingPnl": "5",
        "settlementCurrency": "USDT",
        "allocatedReportedPnl": [],
        "allocatedFees": [],
        "membershipId": "WIN_LOSS_HOLDING_DURATION_DIFFERENCE:win-1:SUBJECT:"
      },
      {
        "reviewUnitId": "win-2",
        "outcome": "WIN",
        "netTradingPnl": "10",
        "settlementCurrency": "USDT",
        "allocatedReportedPnl": [],
        "allocatedFees": [],
        "membershipId": "WIN_LOSS_HOLDING_DURATION_DIFFERENCE:win-2:SUBJECT:"
      }
    ],
    "OBSERVATIONS": [
      {
        "observationId": "ENTRY_WITHIN_WINDOW_AFTER_LOSS:loss-1:loss-1:ENTRY_WITHIN_WINDOW_AFTER_LOSS",
        "definitionId": "ENTRY_WITHIN_WINDOW_AFTER_LOSS",
        "definitionVersion": "1",
        "subjectReviewUnitIds": [
          "loss-1"
        ],
        "observedAt": "2025-01-10T00:00:00Z",
        "attributes": [
          {
            "reviewUnitId": "loss-1",
            "name": "closedAt",
            "value": "2025-01-10T00:00:00Z"
          },
          {
            "reviewUnitId": "loss-1",
            "name": "elapsedMicroseconds",
            "value": "300000000"
          }
        ],
        "membershipIds": [
          "ENTRY_WITHIN_WINDOW_AFTER_LOSS:loss-1:SUBJECT:"
        ],
        "relationIds": [
          "loss-1:ENTRY_WITHIN_WINDOW_AFTER_LOSS"
        ]
      },
      {
        "observationId": "INITIAL_EXPOSURE_CHANGE_AFTER_LOSS:loss-1:entry-1",
        "definitionId": "INITIAL_EXPOSURE_CHANGE_AFTER_LOSS",
        "definitionVersion": "1",
        "subjectReviewUnitIds": [
          "entry-1",
          "loss-1"
        ],
        "observedAt": "2025-01-10T00:05:00Z",
        "attributes": [
          {
            "reviewUnitId": "entry-1",
            "name": "contractMultiplier",
            "value": "1"
          },
          {
            "reviewUnitId": "entry-1",
            "name": "initialNotional",
            "value": "100"
          },
          {
            "reviewUnitId": "entry-1",
            "name": "initialPrice",
            "value": "50"
          },
          {
            "reviewUnitId": "entry-1",
            "name": "initialQuantity",
            "value": "2.00"
          },
          {
            "reviewUnitId": "entry-1",
            "name": "ratio",
            "value": "1/1"
          },
          {
            "reviewUnitId": "entry-1",
            "name": "settlementCurrency",
            "value": "USDT"
          },
          {
            "reviewUnitId": "loss-1",
            "name": "contractMultiplier",
            "value": "1"
          },
          {
            "reviewUnitId": "loss-1",
            "name": "initialNotional",
            "value": "100"
          },
          {
            "reviewUnitId": "loss-1",
            "name": "initialPrice",
            "value": "50"
          },
          {
            "reviewUnitId": "loss-1",
            "name": "initialQuantity",
            "value": "2.00"
          }
        ],
        "membershipIds": [
          "INITIAL_EXPOSURE_CHANGE_AFTER_LOSS:entry-1:COMPARISON:",
          "INITIAL_EXPOSURE_CHANGE_AFTER_LOSS:loss-1:SUBJECT:"
        ],
        "relationIds": [
          "loss-1:ENTRY_WITHIN_WINDOW_AFTER_LOSS"
        ]
      },
      {
        "observationId": "WIN_LOSS_HOLDING_DURATION_DIFFERENCE:loss-1:0",
        "definitionId": "WIN_LOSS_HOLDING_DURATION_DIFFERENCE",
        "definitionVersion": "1",
        "subjectReviewUnitIds": [
          "loss-1"
        ],
        "observedAt": "2025-01-10T00:00:00Z",
        "attributes": [
          {
            "reviewUnitId": "loss-1",
            "name": "closedAt",
            "value": "2025-01-10T00:00:00Z"
          },
          {
            "reviewUnitId": "loss-1",
            "name": "holdingDurationMicroseconds",
            "value": "30"
          },
          {
            "reviewUnitId": "loss-1",
            "name": "netTradingPnl",
            "value": "-10"
          },
          {
            "reviewUnitId": "loss-1",
            "name": "openedAt",
            "value": "2025-01-09T23:59:59.99997Z"
          }
        ],
        "relationIds": [],
        "membershipIds": [
          "WIN_LOSS_HOLDING_DURATION_DIFFERENCE:loss-1:COMPARISON:"
        ]
      },
      {
        "observationId": "WIN_LOSS_HOLDING_DURATION_DIFFERENCE:loss-2:0",
        "definitionId": "WIN_LOSS_HOLDING_DURATION_DIFFERENCE",
        "definitionVersion": "1",
        "subjectReviewUnitIds": [
          "loss-2"
        ],
        "observedAt": "2025-01-13T00:00:00Z",
        "attributes": [
          {
            "reviewUnitId": "loss-2",
            "name": "closedAt",
            "value": "2025-01-13T00:00:00Z"
          },
          {
            "reviewUnitId": "loss-2",
            "name": "holdingDurationMicroseconds",
            "value": "30"
          },
          {
            "reviewUnitId": "loss-2",
            "name": "netTradingPnl",
            "value": "-5"
          },
          {
            "reviewUnitId": "loss-2",
            "name": "openedAt",
            "value": "2025-01-12T23:59:59.99997Z"
          }
        ],
        "relationIds": [],
        "membershipIds": [
          "WIN_LOSS_HOLDING_DURATION_DIFFERENCE:loss-2:COMPARISON:"
        ]
      },
      {
        "observationId": "WIN_LOSS_HOLDING_DURATION_DIFFERENCE:win-1:0",
        "definitionId": "WIN_LOSS_HOLDING_DURATION_DIFFERENCE",
        "definitionVersion": "1",
        "subjectReviewUnitIds": [
          "win-1"
        ],
        "observedAt": "2025-01-11T00:00:00Z",
        "attributes": [
          {
            "reviewUnitId": "win-1",
            "name": "closedAt",
            "value": "2025-01-11T00:00:00Z"
          },
          {
            "reviewUnitId": "win-1",
            "name": "holdingDurationMicroseconds",
            "value": "30"
          },
          {
            "reviewUnitId": "win-1",
            "name": "netTradingPnl",
            "value": "5"
          },
          {
            "reviewUnitId": "win-1",
            "name": "openedAt",
            "value": "2025-01-10T23:59:59.99997Z"
          }
        ],
        "membershipIds": [
          "WIN_LOSS_HOLDING_DURATION_DIFFERENCE:win-1:SUBJECT:"
        ],
        "relationIds": []
      },
      {
        "observationId": "WIN_LOSS_HOLDING_DURATION_DIFFERENCE:win-2:0",
        "definitionId": "WIN_LOSS_HOLDING_DURATION_DIFFERENCE",
        "definitionVersion": "1",
        "subjectReviewUnitIds": [
          "win-2"
        ],
        "observedAt": "2025-01-12T00:00:00Z",